	ID	tweet	label
681	pcm_train_00682	buhari son kee hes probably well secured even agbero chairman piking dem na yankee dem dey	negative
1849	pcm_train_01850	how chelsea wan take win second half like this na na win either half i bet o crystal palace lite about to tear my ticket	negative
1817	pcm_train_01818	ken no fit make heaven sha	negative
3391	pcm_train_03392	lmaooooo na popsie dey settle quarrel that time na so policeman hit boda abayo barber during monthly environmental sanitation stuff a fi laiiiiiiiii boda abayo load am back street scatter again tear gas everywhere when they reinforced	positive
2142	pcm_train_02143	wow so you are married im also a married man that makes us compatible na dem ooo thunder fire your wandering shafts	negative
1939	pcm_train_01940	this one think say e smart e randomly enter dm dey hype me me know say na money so i reply like two messages as i notice say nothing dey to talk again i leave him last whines unread now money message don enter i go wait for like days before i reply	negative
1897	pcm_train_01898	una nor dey update for aftanun abi na us work una dey do	negative
3514	pcm_train_03515	that chips i bin dey chop for momo for your side kept me going mehn that soft golden bread and fish stew bin dey top up the chao god bless yall famms mehn i just miss childhood	positive
527	pcm_train_00528	upon all this likes na only subscribe tragic‍️ try and do am na i wont reach p secs to do and finish make una help me reach k subscribers na	negative
4740	pcm_train_04741	nls chronicles im in ethics class thinking of what to eat and how to pay for the food boom i remember say person fit chop on credit thank god for crown kitchen hustle oo no go dey chop on credit like me here	positive
748	pcm_train_00749	david luiz abi wetin b him name sef have never believed him with dat jorginho iranu	negative
3622	pcm_train_03623	ill probably cry when they play time flies siwezi kuwacha rhumba as i dey dancey jagajaga to my raga dem dey feel am	positive
2454	pcm_train_02455	abeg arsenal make una carry una wahala dey goim not doing again	negative
4227	pcm_train_04228	the next days is gon be fun never been this excited before una wey dey go leave before dey enjoy ooo	positive
5038	pcm_train_05039	seriously e be like say aunty vee don dey catch feelings o	positive
1365	pcm_train_01366	some people no dey text us again as them dey lockdown abeg after the lockdown make we keep the same energy ooo trailer will not jam us	negative
3234	pcm_train_03235	broke guy like us we no dey beg for mcm bcus our girlfriend gan no dey use us and if she does nah only us dey see ham kila wan baka ‍️	negative
210	pcm_train_00211	na me this house wan kill with work any small thing tiles don dirty i will run away to go and get strength to clean you	negative
2151	pcm_train_02152	shut up jooor na people like una no go let person breath thats how some knuckle heads in customs decided to send innocent ladies to dead zone cos they made a video im so tired of the way people of your generation think its freaking annoying	negative
3938	pcm_train_03939	if anybody dey wey i don offend in one way or the other make una please slide in my dm imma apologize either im at fault or youre at fault i go apologize and let all go its december thanks love always ️	positive
2763	pcm_train_02764	abeg where una dey find this relationship nawif na soap abeg cut small for me omo alot happened i don forget some sha we meuv‍️	negative
4060	pcm_train_04061	but youre very talented sir i no fit whine you na	positive
3024	pcm_train_03025	the one wey off me last year na one babe wey dey fully date two guys and leading like three other guys on dey ask me for money shock hol me so tey i wan ask her what about em mandem wey dey at her service	negative
2494	pcm_train_02495	nah person wey done chop belleful nah e dey think of education	negative
2192	pcm_train_02193	shame no dey catch u abi if na ur country d fight holdim sure at a point dem go take light for stadium and d fight go gat wait till dem on gen do and leave in peace in	negative
5076	pcm_train_05077	lol u cannot see my familys net worth cannot enter k e sure me corona con dey again one mouth don commot for their food niyen	positive
4239	pcm_train_04240	please help me hear wetin dis guy dey say	positive
4357	pcm_train_04358	wait oo shey d guy don offend dem b or y dem dey burst am on top bday like dis	positive
14	pcm_train_00015	yess ooo be like e don cancel trip sef sigh	negative
3936	pcm_train_03937	my broda out with a dope tune but as you dey pop champagne abeg give me some beer so that everybody go dey alright support good musiclink pon his bio	positive
40	pcm_train_00041	im in tears guys see how my customer is rocking her bag she made me so happy with this picture e choke abi e no choke lagos nigeria	negative
4972	pcm_train_04973	money go fit me	positive
3464	pcm_train_03465	your header na die	positive
4640	pcm_train_04641	hehe my guy hustle o dem no dey chop fine boy again	positive
73	pcm_train_00074	shebi na zanku wey i never perfect na im these hens are doing anyhow	negative
2492	pcm_train_02493	you no wan preach for the most high now you wan go pray to the most high for watin na ‍️ say you wan high like the most high	negative
2242	pcm_train_02243	yes so na hin wey i wan tell u though still some like my sistou already sent his guidance	neutral
3797	pcm_train_03798	all these foreign people with were updating our policy please sha no comot the small change wey we dey see for our mouth ẹ joor	positive
2042	pcm_train_02043	my padi make mouth to me i flog am o for fifa the real matter na hin be say he don cook and e no cook my own who go help us settle like this	negative
3388	pcm_train_03389	to get over her i havent seen my baby in that kind of situation my boy went offline and wasnt picking his calls wow na so e dey pain he said his chest is paining him the girl did him strong thing to the extent that i had to ban her name from this house that time	positive
2824	pcm_train_02825	nothing gives me joy like cracking a joke just to make my mum smilelaugh when shes angry with my siblings but omo sometimes e de back fire she de carry the joke personal sometimes	negative
1534	pcm_train_01535	dont mind the guy after all the money wey e dey make for writing e still want dey disturb us wey no get	negative
1485	pcm_train_01486	look up the word clown why are you making it look like he said something abominable if a white man calls you a clown im sure you will smile and tease him back but because na your naija brother you want to start reading deep meanings into it na wa for this country o	negative
393	pcm_train_00394	see as person dey miss better airdrops because of phone abeg who get android phone wah no dey in use	negative
2861	pcm_train_02862	then man and woman fuuk for bible na the woman dem wan stone then drag am go city center go meet jesus now e be like man priick dey raise untop e secretary wey no know anything na the woman dem still sack religious men wont keep making women the victim e be things‍️	negative
2377	pcm_train_02378	yeah na tools i use for work and the money if dem comot am next year e go pay me o	negative
2702	pcm_train_02703	i did not say anything first i just tasted it first and ate to a certain level then i went further to ask ehe bros how much be this fish again sef baba said oh bros na change na just i lost appetite immediately	negative
1776	pcm_train_01777	online i want to make mama proud offline am leaving this house na only me una dey send message up and down	negative
102	pcm_train_00103	terrorists re perpetrating evils in broad day light dey walk freely wit it dey wax stronger evryday coz dey av access social amenities and evn amunitionsand we d law abiding and sane citizens re d preys yet our govts stil stand against us are we cursed	negative
4881	pcm_train_04882	please na high e wan high e no kill person	positive
4429	pcm_train_04430	thanks sugar but why you wan knock my job na please im single oh	positive
3652	pcm_train_03653	baba when this credit alert blessing go reach me na abeg people wey don get borrow us una prayer manual biko i need am	positive
1306	pcm_train_01307	e dey do me like say make i konk your head	negative
5087	pcm_train_05088	make i send u gps to k house na there e de happen	positive
984	pcm_train_00985	you dey craze you sha understand just choose one of those una embarrassing moments tell us how e be	negative
2345	pcm_train_02346	champions league never start and leicester don dey lose guard alreadylife fit taya them dis year	negative
3766	pcm_train_03767	i wan use am take ponder on wetin dem teach for church today b	positive
2520	pcm_train_02521	nigeria we hail thee pls i know do again abeg link me with any foreigner wey wan buy citizenship	negative
4037	pcm_train_04038	a spec and half sef	positive
4528	pcm_train_04529	if u are in a relationship with last born love dem cherish dem n advice dem because dos people no get sense	positive
590	pcm_train_00591	una get mind for this app o so even as i carry trumpet announce say today na my birthday nobody fit just wish me happy birthday its alright keeping my comments and compliments to myself from here on out ‍	negative
2035	pcm_train_02036	please oh i wan ask this question can ugandans even read atol because all this scattering una dey scatter them isso unbearable‍️ asin eh they arent even saying anything abin them blind as well because there dumpness is certain already chai	negative
4266	pcm_train_04267	i think im over it sefthanks dear	positive
77	pcm_train_00078	wetin be this wan naa hahaha sylvyyy this wan off me	negative
1258	pcm_train_01259	e no go better for lampard	negative
2358	pcm_train_02359	the lady recording this video lacks respect whats i love this boy you see man wey be captain wey defend una you dey call am boy	negative
1932	pcm_train_01933	e be like say you don drink something were dey make you see things	negative
4398	pcm_train_04399	no be person wey first call police dey win case cross de boss spill out dear im loving the conversation with queen cross	positive
4902	pcm_train_04903	na okocha teach ronaldinho how to dribble go watch the best of okocha you go see him ball ronaldinho just dey copy am but na true sha	positive
4466	pcm_train_04467	thank you ️️️️️ this review e don tey i don dey wait for am ️️️️	positive
5005	pcm_train_05006	e be like say na from tope the k gist emanate from people never kana say na em be the originator he for don chop drags since morning cc	positive
1168	pcm_train_01169	fine boy no dey vex right madam abeg decide already and stop stressing somebodys son	negative
2078	pcm_train_02079	lol u cannot see my familys net worth cannot enter k e sure me corona con dey again one mouth don commot for their food niyen	negative
2444	pcm_train_02445	guy e no work	negative
2823	pcm_train_02824	ah abeg abeg abeg i no like to dey deceive myself my own work na to stan	negative
3602	pcm_train_03603	no be wetin sha na person na my mama n im happy n proud	positive
4796	pcm_train_04797	na baba dey smoke na babe dey high which one be swat again	positive
3057	pcm_train_03058	no dey ask me whether my day was productive again abeg i no dey do anything	negative
4165	pcm_train_04166	i won dey see money from where una dey see money	positive
1653	pcm_train_01654	na wetin make am dey prison so	negative
1665	pcm_train_01666	relationship too hard abeg man go dey vex say you no call am woman go still dey vex say you no call am abeg i want to be hoeing around quitting dating both gender for now till i mature enough to communicate better	negative
4657	pcm_train_04658	abeg naa blow me na you god wan use please naa	positive
2550	pcm_train_02551	person wey i fine pass dey tell me you are kinda cute me kinda isinku e oni sorire oloriburuku somebody	negative
3798	pcm_train_03799	haha no dey loud am now i don dey sabi small small	positive
1599	pcm_train_01600	how i go sleep this night like this wetin i find come twitter weldone o‍‍‍	negative
4518	pcm_train_04519	na twerk we sef dey twerk oo no be like say we no go like shake body when you tanana us	positive
1701	pcm_train_01702	baba you dey vex oo but truly wetin she bi want make we help her do beat the boyfriend	negative
3689	pcm_train_03690	this ghana weaving fit me die	positive
1591	pcm_train_01592	people wey drop billions of naira in cash and other nonmonetary resources to support ahab back in are somewhere chilling and plotting na we wey be say na only tweets we tweet de here de chop curse this life nor balance at all	negative
1207	pcm_train_01208	since my dads younger brother came it has been wks now i don do pap pass my whole yrs on this earth ‍️ na only pap him dey like take	negative
2365	pcm_train_02366	masquerade wey say e won dance before say e no de dance again rest jhur	negative
3130	pcm_train_03131	dont mind them as basic as vitamins they dont cover even zinc sef once youre above years no level for you	negative
92	pcm_train_00093	if you love rap song go and listen to ft eriggaraw dey burst my head abeg every verse is raw even the fly gangsta album na raw unrefined	negative
2804	pcm_train_02805	person dey untop your case already and you don dey give am attention warming up to him already but you still dey entertain other niggas	negative
3706	pcm_train_03707	im already doing house help work here for free e no go be problem as e don master my body	positive
1721	pcm_train_01722	if someone had helped me loud this to my dad in e no for be all this one wey dey sup oh	negative
2772	pcm_train_02773	she na like this we go dey dey so many heart shattering news hitting us on daily basis in niger state my heart is broken rn ya allah come through for us	negative
613	pcm_train_00614	that title is too heavy na imagine if she was our daughter one guy will just be having a swell time without dropping yam noo oo i cant take this lia lia she no even hide am na hin dey pain me i will report her to her brothers this is korupshun	negative
332	pcm_train_00333	na like league dem go dey na we dont hate them like that na just one more year make dem fight relegation small	negative
60	pcm_train_00061	i just no wan curse people doing this face and account thing why you dey give pesin hbp like this	negative
3022	pcm_train_03023	rain pls is enough i dont wash my blanket for threedays now e no fi dry am tired of taking it in and out like a patient	negative
2375	pcm_train_02376	allah ya isa auto refresh i just saw something and was about viewing profile now i no fit see am again	negative
2477	pcm_train_02478	when gist don dey sweet na him these people go change am to commercial ‍️‍️‍️	negative
78	pcm_train_00079	every single time wey man united get chance to climb up the table and boost top four hopes dem go mess up na wetin happen last season when we think say ole go make top four e blow am e don start again	negative
2781	pcm_train_02782	lmaoo yesterday one bike man was like shey tori corona yii no e ti e le	negative
2168	pcm_train_02169	why these players no ready to score bayiii make all the chances wey dem no use no con koba us bayioo	negative
2144	pcm_train_02145	wetin dey happen for betis that scoreline changed quickly chai would love to see jovicbenzema combo who say make i fleet o	negative
2912	pcm_train_02913	god im done imagining how money would fit me just bless me with this moneyi already know it would fit me o god	negative
963	pcm_train_00964	your own better i swear atleast na still season film dey inside i bought vikings season at ikeja just because i was in a haste i got home to know what i actually bought was zootopia na cartoon i buy	negative
793	pcm_train_00794	what a sense of humor this guy will think he has entered the spotlight with this nonsense he did enemy of progress cos e no better for so make e no better for others too shuuuo who mtn or any service provider help all the deductions dem dey do we too no fit chop	negative
1498	pcm_train_01499	me wey buy self i dey regret why i waste take buy am e be like na chips wey spoil them use	negative
4405	pcm_train_04406	amin make i go baff wia cloth na me be bread winner chai	positive
2122	pcm_train_02123	even fut boy wey babes dey use form no dey beg reach like this	negative
4928	pcm_train_04929	me wey don dey the hangout already ti won ba so mi mole lojo yen ma ja	positive
1105	pcm_train_01106	you are a spurs fan na cotton wool dey una head	negative
2593	pcm_train_02594	praise go dey wank if e see small skin for movies i fit bet am	negative
930	pcm_train_00931	fam you collect slap from peruzzi wey still dey upcoming e just dey like for keke to jam you instead of benz	negative
3089	pcm_train_03090	is that person your relative oga ooo na like this una dey do	negative
4682	pcm_train_04683	youre a chief na see the kind picture wey dey your dp	positive
3540	pcm_train_03541	ndidi na rugedy babai like him always a nuisance to the opposition i wish kelechi can get a goal in this game e don try	positive
2656	pcm_train_02657	my tl is so boring tiktok wey dey help person cure boredom sef no gree open since yesterday iru ki wa leleyi oluwa	negative
3566	pcm_train_03567	miracle always brings his a game everytime dude is always making efforts and doing us proud why wont i vote for him in fact i registered a lot of peoples numbers just to vote for him me sef im bringing my a game to vote for him im a big fan biko starboy	positive
3479	pcm_train_03480	i had in jamb and or in post jamb walai god will punish unilorin they denied me admission i had to collect kamu and go to poly poly wey everything na gragra years and your result is shit dem go dey price you k thank god for tech	positive
434	pcm_train_00435	this woman here dey cough like she wan cough out her lungs abegi oh me i don go inside	negative
2521	pcm_train_02522	shey e no better make i dey my papa house like this they cannot lock me in that prison yard for months oo i fit crase	negative
4505	pcm_train_04506	im enjoying these heartbreak stories mehn e dey sweet like dodo ikire	positive
688	pcm_train_00689	god yunno go understand like the k dem collect na smth wey i just load ohh and na new sim i fit even borrow so u see e just happened like that like u still dey shocked	negative
2240	pcm_train_02241	nigerians can look for trouble sha una done go another country show to start una yeye comparison drama allow them enjoy their show abg where una bbn start na wa	neutral
3009	pcm_train_03010	english she isnt backbone yet she is on her way street use ya head nor be everything dem dey explain e get why porn nor dey get subtitle	negative
1216	pcm_train_01217	wow wahala don reach kada be that na	negative
3709	pcm_train_03710	naso na i no like make person no dey gree you i just dey wynn you actually you good really good i enjoy playing with you cause d matches dey always dey intense	positive
243	pcm_train_00244	people out here already getting second dose of vaccines and im still here hunting down first dose dem say dem no gems dey give again please epp anybody knows anywhere in lagos i can get the first dose of covid vaccine please kindly refer	negative
4872	pcm_train_04873	i don see lot of men but na only you you smile the brightest as e dey goi go dey love you my baybe	positive
1674	pcm_train_01675	na your papa get when you dey select people when you wan see for	negative
567	pcm_train_00568	my brother sells and supply dried fish you can place your orders delivery within and outside niger it comes in different sizes large medium small super small r e t w e e t our hustle please	negative
1651	pcm_train_01652	na one unfortunate person e go b na wetin u expect	negative
4783	pcm_train_04784	its not been long you left us you fit still come back	positive
3587	pcm_train_03588	fine boy wey kon sabi sing again wetin you need again	positive
1343	pcm_train_01344	imagine you wey no get car but you dey do giveaway you go come see person wey win giveaway from you wey dey do the face vs the car oh the betrayal	negative
3282	pcm_train_03283	na to appease the gods to break the curse but even the gods sef dem don tire for nigeria matter so tay our early morning kainkain to the ground nor dey make sense to dem again	neutral
948	pcm_train_00949	lmao shebi na una wan dey carry mata for head enjoy	negative
3848	pcm_train_03849	made me laugh today untop feminist fight wey dem wan fight cool station	positive
4322	pcm_train_04323	its not been long you left us you fit still come back	positive
179	pcm_train_00180	i went through my phone this morningi found this video omosolaa e bi like say you don dey do am no bi today i missed all house matemore blessing	negative
1891	pcm_train_01892	na wa o see how dem hug as if say na fight	negative
4515	pcm_train_04516	rich men are funny men meeting for am casually moved to am and now pm its so funny that im contemplating on waiting here till pm because this house be like say na abroad i dey the ac is not even normal ac	positive
2115	pcm_train_02116	na only mumu dey ask fish if e don baff	negative
4751	pcm_train_04752	regrann from tundeednut ladies and gentlemen we cannot get enough of this hottest slang na dem dey rush us and we no get choice but to rush una too to order your finely made t	positive
4348	pcm_train_04349	a client gave me k to make a birthday cake for her daughter with icing sugar i told her ma this money wont be enough to do what you want my mum was like do it for her na na we we in my mind shey baby we we i dey use fo market i dont like doing business with my mums crew	positive
502	pcm_train_00503	finally dr pam pam don vex for me but am just joking ni on more serious group wealth is good so i dey envy you bro i don change my group of friends to lekki and banana island group no room for ikorodu friends again	negative
1437	pcm_train_01438	una dey try with this una increment to scare people	negative
2073	pcm_train_02074	so sun fit comot after the flogging rain did me this afternoon	negative
3885	pcm_train_03886	lol you dont have to wait till den o im here for u just come and propose and im urs for life	positive
304	pcm_train_00305	lmfaooooooooooooo na why church dey tire me rich person testimony dey different always different from broke person own	negative
3738	pcm_train_03739	help me tell my family members im normal oh abeg no be mad i mad na blog content i dey create now that youre here please take a trip round my blog	positive
4498	pcm_train_04499	so na twitter for iphone i dey see under your tweets abi u wey dey criticize apple wetin change your mind bruh so las las you owned one congrats on board	positive
513	pcm_train_00514	uncle calm downno be when we see if e reach us we do the needful thé embelembe way na meanwhile cheated on me yesterday e dey pain me	negative
3246	pcm_train_03247	i dey tell you na mumu girl dey shout i be ph girltf	negative
4421	pcm_train_04422	loooli don place the order today my account no dey funded like yours fam we dey gather am small small	positive
904	pcm_train_00905	i hope youre not talking about shema lmaoooo because that shema sef dey wonder how your money dey color	negative
1421	pcm_train_01422	na d same people make say buhari don scatter our country na same we dey flex data dis night oh nothing clear again oh	negative
529	pcm_train_00530	me when you tell me that im handsome stop whining me na tell me im pretty ill know you mean it	negative
1353	pcm_train_01354	e dey pain me i been get people wey wan knack me but i dey form good boyfriend	negative
4310	pcm_train_04311	i jus dey feel dis and biko meanwhile if you bring your own oh or you want make we help you go anyone we dey our sweet~belle go be to make sure say	positive
2554	pcm_train_02555	brain why you de do me so	negative
3788	pcm_train_03789	sure sir me i want to even bet with a man u directly ni like oneone sir make e no be like say na mouth dem dey make	positive
2811	pcm_train_02812	first time i knew i wont fall as onitsha boy wey i be buh e shock me when e come be like say we dey enter potholes for air ‍️	negative
2819	pcm_train_02820	cuppy abeg neck dey pain us neck dey pain us make we see chance breathe	negative
2440	pcm_train_02441	i still cant believe you have you tried those ones that grew on foreign lands our own doesnt have sugar not so juicy sef	negative
690	pcm_train_00691	do we look like terrorists mugu wey dey yarn dust when he don see microphone	negative
2450	pcm_train_02451	very stubborn af and you cant even beat them sef mummy will come to their rescue	negative
1374	pcm_train_01375	na person wey no gree go prayer walk go do strong house chores today shebi i for just go	negative
883	pcm_train_00884	pls oo all those ladies dat usually chat up ppls boyfrnd to ask dem wen are we gng to see or wont u cm andsee me pls aunty sorry o but wat exactly are u guys seeing for una wan do praise and worship if any bitch tries dis with me i swear sumone is going to die	negative
4092	pcm_train_04093	~ wetin be love if you no dey oh my baby iwo lo fun mi layo no one complete me more if i no get you its like a heart without a beat wetin be love if you no show like water wey no dey flow never knew say one day you go be my own forever	positive
5108	pcm_train_05109	fine boy like stayboy dem no they rush nike na nike dey rush am	positive
228	pcm_train_00229	i don go do blood test dem say na typhoid won kill me	negative
3985	pcm_train_03986	guy like us no dey look for love na love dey rush the polytechnic ibadan	positive
2212	pcm_train_02213	abeg obo you don pass this thing wa you won do if na burna dey ask this question i for understand	negative
4804	pcm_train_04805	if he no chop like that how e go sabi play that football wey e dey playenergy	positive
3124	pcm_train_03125	i don tell u say na wetyn una go play since morning this is d end chelsea scorednot from a mistakenext game p	negative
