	ID	tweet	label
4956	pcm_train_04957	i go model my thing myself or you free be like say na you be the only fine boy wey i know wey no be player abi secret league lọ ń play ni i for call ó but e go say mek i go meet management	positive
1558	pcm_train_01559	haba kilode which kain designer signature be this this person does not sign its	negative
3660	pcm_train_03661	why you come dey do like say you no wan dance o looking at you pretty face theres mistake that im crazy about you you bursting my brain baeby youre bursting my brain i no go lie o baby me i no fit lie o oo hassaniiii i live you die	positive
1712	pcm_train_01713	lmao na real period ammean bro the period wey dem put much fear in there life about it	negative
1038	pcm_train_01039	nobody dey gree to dey toast me again baby see me i don dey believe o	negative
3252	pcm_train_03253	please before you dm me or reply my dm go through my media its not the one you will request for my pics and then stop replying me after i send you some pics na ugly i ugly i no kill person and e dey pain very much	negative
1446	pcm_train_01447	abeg na people dey work for now warri nigeria	negative
2723	pcm_train_02724	i feel like na food i go de chop in my labor room please gimme barbecue chicken before i push	negative
961	pcm_train_00962	lol how my queen go dey do that how person wey go raise my kids go dey knock gala out like that	negative
4780	pcm_train_04781	serious wahala for people wey no dey use vsp botanics dont procrastinate rush now and place your orders on vsp botanics ig page and join the glowing skin gang the quality is premium and effective for your skin	positive
4904	pcm_train_04905	now now you don reach owerri i think say na ihiagwa you dey	positive
4847	pcm_train_04848	omo this love don dey enter my body again i think say e no dey last ni i was wrong	positive
4976	pcm_train_04977	lmao dem don dey sub oddy	positive
1390	pcm_train_01391	e just be like say make i don close cos as ukeme dey tweet the for tl i feel like to cry o	negative
4477	pcm_train_04478	its a beautiful day a yummy kind of day oya ooo we don open make una come order cake and small chops ooo we dey dm dey wait for you have a blessed day	positive
2259	pcm_train_02260	lmaoo na only him dem dey miscomprehend only him	negative
4962	pcm_train_04963	if chance dey u for join dem don jazzy dr sid and face list tiwa is really pretty tho	positive
2935	pcm_train_02936	lmao my secondary school no fit even do that sco whatever thing i doubt say we reach wey dey active for twitter d skul ratchet as hell zero boujee standard for that ends na only biola dara sochima and muyiwa dey this twitter as far as im concerned	negative
4744	pcm_train_04745	please dears dem dey help us wey wan retrieve sim no spoil market	positive
3198	pcm_train_03199	im chatting with my long time friend on whatsapp and he ask me to send him one slippers he saw on my phone that time i said lemme check my phone and he be like che nah dat phone you still dey use e shock me	negative
34	pcm_train_00035	forex trading be like baba don put hand for head alot of persons make the mistake of opening multiple running trades abeg how you wan manage them without running mad	negative
3432	pcm_train_03433	help me o because i dey baff my neighbor fowl with hot water him dey call me thieve i do bad	positive
1905	pcm_train_01906	wen sapa wire u sumtime u no go even remember say u get dick no vex match teacher	negative
1227	pcm_train_01228	just this morning oo i decided to make egg sauce and i bought eggs from aboki store close to my house broke eggs already reaching the th one kpa its spoilt nah so nh take waste omo i no fit vex nah	negative
1273	pcm_train_01274	these patients no gree come since oona when man wan go find food na him dem dey fall in e no fair na	negative
687	pcm_train_00688	abeg use style check my media you fit see wetin you like i don broke ejhooorbikoibegpleasembok	negative
4079	pcm_train_04080	generally speaking with is here again whole lot been said about the previous editions but you see this edition e go madoooh with alist comedians	positive
3250	pcm_train_03251	dey press the weyrey like bread wey dey wan buy	negative
2762	pcm_train_02763	se una no go return my money before i dash una something else spiritually abi both capital and interest i didnt see anything e go contribute small for my school fee oo is like you people wanna craze and you will see it	negative
3639	pcm_train_03640	dude the way you dey deliver sub na you build uk subway o	positive
3435	pcm_train_03436	na so we we cum dey go the drive sabi drive in a way wey e be say this lady dey fall on top me at every sharp bend and speed bump local man was battling with seeing clearly and controlling john tomos	positive
1640	pcm_train_01641	lolshey na u wan rush dem you go find dem na	negative
1759	pcm_train_01760	na wetin wan keep person na im you dey find	negative
3613	pcm_train_03614	i don dey love you for a long time my boy e be like say you no know say i care i wish you knew what im feeling for you darling youre so extraordinary and thats no ordinary thing and they kill killed and keilt it	positive
15	pcm_train_00016	person wey i wan shoot shot to don egbonzone me again ooo	negative
568	pcm_train_00569	shes and so wetin dy pain me pass rn be this young rich bro who committed suicide because of false accusation on rape twitter shey na like this e go dy go ‍️	negative
1803	pcm_train_01804	my guys and i are just roaming the streets of ogba looking for cheap street food that we might not even eat i no get appetite sef asas eye adaba is the soundtrack for tonight this thing pain us o e pain us we are depressed together	negative
2424	pcm_train_02425	some people will see you drinking water and be like bros make me sef drink water na theyll see you eating bros make me sef chop too youll be breathing and they will ask you to buy oxygen for them to breathe too guy chill tf out na	negative
3043	pcm_train_03044	reminds me of the ceiling fan i bought in uni for k na up e de blow go e no blow come down	negative
2625	pcm_train_02626	be like say no be first time wey dem don hide face for guccy snaps	negative
3410	pcm_train_03411	omo that match wey i bin don equalise only for u to score the th i wan crase i just happy say u win that round cuz if not we fit still dey play go	positive
676	pcm_train_00677	since burna dey make music for this kind p when the time reach na fem guys con dey jam i no wan push no agenda e jus funny	negative
2867	pcm_train_02868	person father die this ones dey say make dem stop to dey cry	neutral
2674	pcm_train_02675	it will be a travesty of justice to include dasuki and not marry him wdiezani on the same stake let di same bullets kee di of dem together	negative
3791	pcm_train_03792	i dey ur entrance already u no fit block urself maybe i should kuku assist u sef in finding the money its a good thing to be of help	positive
5032	pcm_train_05033	so this new v bank has been trending and i don open new account whats next make una reason my matter na as god go bless una times thankio	positive
2930	pcm_train_02931	abeg make we no dey do like this i still dey young	negative
2878	pcm_train_02879	$k is big money o plis dear you can bless me with $k sef im a sweet boy and i dont do jazz im also in the bearded gang plus i have medical degree take my aza make god bless you	negative
4282	pcm_train_04283	for not proving point is just a class nengi above em yeey e restrict airflow jor	positive
1430	pcm_train_01431	i dey vex seriously faaa make dem start make we see sha or else na sunday igboho go take over their uniform last last	negative
4446	pcm_train_04447	lmaowhy re u like this na u wey don chop life finish for ur area	positive
4638	pcm_train_04639	what are u trailing me im actually on my way to rccg youth convention and i just passed magodo sha look gooding gurl wey sabi geography	positive
2788	pcm_train_02789	today wey i say make i stay house my mama don list like different things wey i go cook	negative
4558	pcm_train_04559	mouthwatering yeah i know you can have yours too fresh okra soup with better swallow wey hotyou know as e dey be na tasty meals and soups delivered fresh to your doorstep homemade and very delicious call us today or slide in to place your order️	positive
618	pcm_train_00619	at least chelsea fans go dey alright say them dey face ban but you see this my arsenal tosin na only jersey release we just dey celebrate and unnecessary transfer rumors and no be say we dey face ban like this	negative
4338	pcm_train_04339	if he no chop like that how e go sabi play that football wey e dey playenergy	positive
3499	pcm_train_03500	a lot gan we even dey demand more sef oloriburuku oshi una no go ever talk true lai lai	positive
4277	pcm_train_04278	chai from number one to number five all stunning lemme goan admire them again sef	positive
3459	pcm_train_03460	this kind good thing go good to reach ibadan na shebi dey say charity begins at home bring this for us around ui lets enjoy small na ejoor	positive
185	pcm_train_00186	i played straight from my heart for this taxify driver when the song finished he said abeg you fit play that your straight from my belle song again abeg i really feel that song	negative
1816	pcm_train_01817	omo na so i go help person set him system and put software finish come mistakenly format the hard drive na we dey settle since ooo	negative
2023	pcm_train_02024	you dey vex for dem before	negative
1194	pcm_train_01195	awon ryan el rufai e no dey rate hin followers at all we kuku don chop blocking tey tey	negative
4426	pcm_train_04427	betalicious morning salutations to you my korrectest pesin time don reach for the ogbonge show on top wen dey baptize you with high moral wen you need for your day w	positive
5026	pcm_train_05027	like for real mehn shelby and cigar=and na this guy dey make me dey use cigarette do lipstick	positive
507	pcm_train_00508	dey go dey do like say na only them be student na dere cds i dey for service i dey always change am for them ni	negative
734	pcm_train_00735	really would love to get sister locs but im too broke like way too broke for that i shouldnt even be thinking about it k don comot from my account already just thinking about sister locs	neutral
531	pcm_train_00532	covid has done more damage dan good to me dis year d fact dat i wont be able to open my store dis year is so heart breaking whenever i think about it i just feel like throwing myself on d floor while wailing my eyes out its so unfair	negative
1285	pcm_train_01286	corruption don jam corruption our country is a joke	negative
3521	pcm_train_03522	baba good morning but today is the abeg credit me na k na something oh	positive
4869	pcm_train_04870	i dont even know where to start from koz my parent love that show like and nah night them dey watch am so sometimes i used to be like why cant they show this thing at morning i dont even know how to express my selffeelings towards this show abeg i just dey type shit	positive
2041	pcm_train_02042	be like say no be first time wey dem don hide face for guccy snaps	negative
1902	pcm_train_01903	lammyng dey vex bruv	negative
2838	pcm_train_02839	stop dishing it out in large quantities nobody is cooking anything ooh small small make e reach all man for dah yellow canopy wetin be dis abeg oohbe joting	negative
2509	pcm_train_02510	na girl wey no get good character dey fear mother inlaw	negative
3441	pcm_train_03442	na so me sef shock dear na me fuck up sha	positive
2367	pcm_train_02368	na why no gree enter love for yrs now oohhshey we no go carry am go bath dis geh for river now eehnn	negative
4550	pcm_train_04551	oya won lenu ni sir if rangers catch them for that playoffs dem go chop cane again na nairobi straight	positive
3400	pcm_train_03401	d tin dat is paining me is dat d guy doesnt like her like dat sef	positive
3310	pcm_train_03311	lmao i swear e be like person wey dey argue with google	positive
4690	pcm_train_04691	am finally e don happen first official kiss under the duvet lol n weldone o even if we no fit see unawe can hear una is now a ship lol wellwe are watching you both	positive
2074	pcm_train_02075	bro i rather go back to arsenal na champion we they no dey win no be overall failure them be person go dey jolly if them win fa cup buharitrump lord forbid bad thing i had to beg them on bio not to follow me	negative
4527	pcm_train_04528	unnecessary rudeness sef daz y im always a bitter leaf to them sha im hausa too	positive
2919	pcm_train_02920	im stressed because of that club no jokes if spurs win uefa e go pain me if liverpool win e go still pain me same thing if arsenal win europa e go pain me if chelsea win e go pain me no joy anywhere im in a toxic relationship with that club atm	negative
2498	pcm_train_02499	shey you dey see wetin you don help uganda do us	negative
3710	pcm_train_03711	e dey sweet my belle die	positive
3601	pcm_train_03602	waking up to dis cuteness pikin wey fine like dis ️	positive
2596	pcm_train_02597	you dey vex for dem before	negative
2602	pcm_train_02603	you go give somebody money you go tell them not to tell anybody before you know it them don go tell their friends now my dm don full with accnt details e be like say i no go dey use whatsapp again	negative
941	pcm_train_00942	bro abeg leave arsenal analysis na shebi you dey support manu abeg leave trash for lawma o	negative
3583	pcm_train_03584	yes maam you know the traffic just de reduce nah why i reach now	positive
4190	pcm_train_04191	normal guys stuff sha una sabi how many times una dey argue for osogbo that time even on top small wot	positive
828	pcm_train_00829	lol no be wetin kidnapper wan hear be that o dem go dey reason you from a highendhigh maintenance perspective na when cramp mandem and him begin chill with dem for their den you go come dey explain how much perfume be for market	negative
3143	pcm_train_03144	na whete you wan make we park the jet when our president dey london for oshodi so we can save money haba ️	negative
2768	pcm_train_02769	na this welcome back process dey pain me pass for this phone wey i lose	negative
4412	pcm_train_04413	the bike i enter today was cleaning his white shirt and face while driving on an untarred road baba knows dat his shirt will turn brown but ma own life e wan put dangeromo ale werwey re o i felt like given him hot slap from behind but a spirit calmed me down	positive
3765	pcm_train_03766	one day i will share them i love you edikan and i miss being your bestie as you don replace me with make una no worry im waiting patiently for you both i miss you bombom	positive
4781	pcm_train_04782	guyscrolling down my tl na only your lmaaaaaoooooooo i dey see everywhere who dey lick u dz morning	positive
3733	pcm_train_03734	abeg help us tell dem maybe dey can hear you	positive
3265	pcm_train_03266	if dem born you for nigeria automatically life don dey ahead of if you come fall for poor family if you come be first born paddy take life jejena money dey make normal problem be like spiritual problem	neutral
4121	pcm_train_04122	i don gree already no wahala yourself sweetie mi i hope you are good my dear i don dey in charge back	positive
309	pcm_train_00310	sanwo olu ti aláro ba nipe o ma da fun e alalé o ni je ko da fun e in fact awon mejeji o le agree ko da fun e sef you fucking cunt	negative
2515	pcm_train_02516	una don dey overdo am for the benin city which one small pikin when never reach dey do for hk make una calm down chairmen abeg no go spoil smallie life because grown up boys nor dey loyal again shuoooo wetin dey xup na every body must do yahoo	negative
2950	pcm_train_02951	nigerian parents are the best when it comes to disciplining a child pikin go dey cryshoutdey beg his mama or papaparent dont care at that point dem must to just flog that thing out of you heard a gal crying outbegging her mum mama is busy doing justice	negative
2996	pcm_train_02997	abeg donr release it o cos either gen or pumping machine one go give way i am spending money not budgeted to repair pumping machine which the coil got burnt after i used gen to power it	negative
1496	pcm_train_01497	awoof dey run belle them say na herbal malt e be like bitterleaf soup tueh	negative
2428	pcm_train_02429	ahswear not only that my dear i even thought bida was moved from it original location self the journey no wan end e come be as if na one state i dey go	negative
809	pcm_train_00810	taxify chop my money last year gan dem wan start again this taxify bolu	negative
2132	pcm_train_02133	she say the k na christmas giftshey na with blocking on all social media platforms pesin come day use say thank you una no go kill pesin for this country	negative
2104	pcm_train_02105	everything buhari commission during der change eranone of dem is functioning yethe wil recommision dem during der next level nonsense wen dey start functioningjoke of a country	negative
322	pcm_train_00323	as u talk say u de support man utd i com de feel say dis beauty went to the wrong person its all love thoo	negative
450	pcm_train_00451	thank god you will pass through park corona will say hi hey even that place sef na where this virus fit spread for aba problem dey	negative
1175	pcm_train_01176	god i am so drained feels like ill faint sef	negative
2224	pcm_train_02225	if this nepa should blink this light one more time ehnn i de go nepa office	negative
2227	pcm_train_02228	you sabi cook you sabi cook but you sabi make pap	negative
3390	pcm_train_03391	you brilliant na me wey be say na me dey coordinates panpa for my set our room na neco office cc	positive
2796	pcm_train_02797	de beautiful smile dat i never c like dat fine face	negative
1104	pcm_train_01105	blood of malachi see as zambia just wan tear my ticket algeria dey house dey play like visitors	negative
2083	pcm_train_02084	na meat wey nor dey inside soup na make stockfish dey form celebrity	negative
1069	pcm_train_01070	this boy is still protesting that i called his men rogues ikorodu no be good place apayan ni won if you love your life avoid that place na hell my girl head don stiff arm don swell up ika ni yin ni ikorodu oooo awon apayan greedy wicked armed robbers	negative
2966	pcm_train_02967	i wan sell perfume na so i go tell this dude say he smell nice now hes becoming too friendly iz laik i don find trouble oo	negative
2	pcm_train_00003	dis is unfair of urcompany goingtowks nw ive bin complaining abt d subscriptioni did wch did nt reflect on mydecoder nd im givin u an ultimatum else u willbsurprised my next reactnim makin dis publicly nw ive chatted u privately showing evidence of payment	negative
3650	pcm_train_03651	atleast try follow back na make i fit dey steal some ideas from your tl before i come collect the soap thank you sir	positive
4469	pcm_train_04470	fine deal like this na dem dey rush us	positive
3031	pcm_train_03032	our government no dey hear word they are deaf to the people na lie na until they take one of em abi	negative
648	pcm_train_00649	i get two weddings tomorrow materials don land buh was super lazy to sew now im tryna dodge em and idk how one na my tenant the other guy na childhood friend from church plus i get burial condolence same tomorrow i just want to be a toddler again god	negative
2249	pcm_train_02250	im not even talking about jungle justice he is talking in the nonsense and they are looking at him saying he was asleep and all sort hin mouth suppose don tear	negative
358	pcm_train_00359	as this country is going e be like god don comot hand from anything wey concern nigeria cause whats all this sad news everyday	negative
2198	pcm_train_02199	wetin musa ni go see for gate	negative
2818	pcm_train_02819	d kind waka wey i waka this night god pls i dont want to ever experience it again	negative
2343	pcm_train_02344	ur mama never chop but you dey pop champagne you wise kindly retweet and add yours to it	negative
3160	pcm_train_03161	my bunch of keys decided to divide themselves the half i need to open d house doors fell at d office d remaining half wey be office keys r so intact in my bag as i dey like dis na in front of my door i jst siddon siddon dey look	negative
3303	pcm_train_03304	please ooo i am not hurt i am just reacting to a tweet i saw about soft men even saw people who have dished pain to the softest men i know waggling their tail there na wetin vex me i am good my women dey try ️	positive
2219	pcm_train_02220	these people should use better ink the write expiry dates na some of us wey our eyes no good no fit read am	negative
3414	pcm_train_03415	lol how many ratio you don chop on top this tweet and e never even blow my guy o	positive
4903	pcm_train_04904	e good as na them dey do themselves	positive
1608	pcm_train_01609	i no fit ask my friend again ️️	negative
211	pcm_train_00212	the day you line trip off na that day nepa dey leave light for hours come make you dey feel like jonah of the adugbo	negative
2200	pcm_train_02201	abeg wetin dem ask kana wetin she dey talk ‍️‍️‍️‍️	negative
88	pcm_train_00089	my boss is a definition of pepper them jezzzz you dont want to know what he just did for me mehn im so happy rn please help me to thank him im forever grateful dont worry fam una days go still soft	negative
4893	pcm_train_04894	i really might not be the best but im such a baby girl porthacourt peeps always asking wheres landlord na so una take miss landlord yesterday ooo even called me landlady	positive
2592	pcm_train_02593	you don wanna know after my laundry guy brought my clothes yesterday madam para dey vex say i dey live like king for here say ion dey wash guess who washed her clothes today	negative
3931	pcm_train_03932	lmaooo i swear i no see the tweet wey you dey reply to but i don get now okay nice one	positive
2113	pcm_train_02114	once stepped out to buy stuff the girl say around yrs i met there sitting with her mum i addressed her as lady mama change am for me oh shes not a lady na so una dey take spoil peoples daughters shes not a lady na girl biko ha	negative
3276	pcm_train_03277	im not saying u shuu nor kip dreads o but when u are not treating it right haaa heaven is not meant for u laidat o this girl don choke life comot for my body her head be smelling like armpit of mad person i wanto faint entering micra in ibadan is risky o	neutral
2392	pcm_train_02393	lol ah who dey reject you dem dey craze	negative
439	pcm_train_00440	omo e just be like say man dem dey konji prison	negative
1529	pcm_train_01530	i think say na only me reason m na mumu dey worry m	negative
416	pcm_train_00417	so i cant visit my village in peace rat don chop my new earpiece wahala dey for who still use earpiece	negative
1330	pcm_train_01331	abeg you fit give me your baba number me sef wan do ritual o	negative
1955	pcm_train_01956	broda he just he like say make person go meet baba say make him do level for person make you con dey make mouth for street not knowing say some people way no talk way just dey look you get wetting them fit do you so tay the person no go fit carry one hand self	negative
2029	pcm_train_02030	so all of una wen dei find babe una area and school or place of work no reach again youve finished tasting dos ones o di e gwu	negative
4111	pcm_train_04112	na person like you dem dey rush	positive
2208	pcm_train_02209	e tey rain dey beat me like this sir i dont have picture anywhere close was checking all my stupid apps and i found this on badoo	negative
1631	pcm_train_01632	but sef the green light dey be like amber for my side e no clear well	negative
3434	pcm_train_03435	who know make dem warn them this night oo which kind nonsense una dey practice na person go load card to credit person na problem to call for una to answer na problem if una allow me call my village people this night e nu go better for una o	positive
3334	pcm_train_03335	been long i let go and screamed o and breathe fresh clean air walahi if u see wetin we dey breathe for this lagos eh tufiakwa na god dey save us i miss drinking fura i miss buying suya at terminus i miss buying coconut bread at ahmadu bello way	positive
286	pcm_train_00287	na lie sef i no dey do again i don see that your picture you go just make me feel inferior	negative
1507	pcm_train_01508	afp go to school you no go hear na main market ur mind de shebi you don see ur life	negative
2467	pcm_train_02468	and don collide ontop my mataabeg una sure say no be sub i come this life con sub like this	negative
1006	pcm_train_01007	lmaooooooo its not a matter of prayer baba if ole doesnt fix his shit hed go this one wey your coach don dey yarn okoto like this nah l him go dey drink incoming l against chelsea	negative
3166	pcm_train_03167	married men married men married men married men married men married men married men married men married men married men how many times did i call u stay away from my dm stay away from my dm d ones wey i get for real life sef no be sey i want abeg	negative
572	pcm_train_00573	i miss ping pong game and swimming ‍️ i just dey chop dey sleep like mumu here	negative
4120	pcm_train_04121	for mesome things dont invoke fear death death ke he don baff even mr death know say i no send i don die since mtcheew	positive
3572	pcm_train_03573	guylike e don de too last pass gionee battery now	positive
719	pcm_train_00720	be like person put boiling ring inside our over head tank cos water wey dey comot from shower and tap be like wetin dem wan take make eba at am god abeg april no too early for rain to start to dey fall everyday nah abeg	negative
4913	pcm_train_04914	man wizkid is fucking good dey chop beats like say na hot akara	positive
301	pcm_train_00302	oga banks wetin dey occur na the day wey i go sleep early make i wake by you post in play for today again you shift am to i offend you	negative
4000	pcm_train_04001	watched twice they girl wey use get better bum bum na that bumbum i dey juse dey notice	positive
3249	pcm_train_03250	you stay inside theres heatyou stay outside mosquitoes sef dey these are tough times for the poor people	negative
