	ID	tweet	label
2536	pcm_train_02537	all dese govt workers go dey dress like skreps even their youthsif dey come see person wey dey manage wear better cloth like this na beef u will see a young girl looking wetin i no go see for ds house of assembly abeg nobody fit kill my shine	negative
2071	pcm_train_02072	thanks dear not like theres anything to be happy about sef	negative
4312	pcm_train_04313	ok today i saw not just dat we even had a conversation like he literally told me e choke️ at dis point i made my parents proud️️️️️ period	positive
1143	pcm_train_01144	na so dem recommend anointing oil give person say na beard oil i dey fear una for these streets	negative
4993	pcm_train_04994	na project pastor chris sure pass the way i dey look am make i still dey observe am first we go start in months time	positive
986	pcm_train_00987	lol i get person wey dey come naija na make i still pay shipping you are hi	negative
1916	pcm_train_01917	nowadays relationships na women dey break men heart wahala don too much	negative
1533	pcm_train_01534	follow follow were do you know they are going you just wan follow na u suppose dey conduct house fellowship	negative
675	pcm_train_00676	nah nah e done forget say day like this go pull up head his fmr aig tiff done dey e blood	negative
2344	pcm_train_02345	abeg leave burna sometimes na so high grade dey make use yarn okoto na we we know	negative
3661	pcm_train_03662	oh me sef suppose attend our general cds tomorrow oh but ib still dey sweet me na clearance own i go attend next week sha	positive
2098	pcm_train_02099	laycon don start again o wahala ma wa de bayi o this is obsession	negative
2068	pcm_train_02069	naso my naira don go	negative
2652	pcm_train_02653	the woman that washed my hair on saturday its like she gave me a different shape of skull head just dey pain me e be like some part don enter inside sef	negative
3199	pcm_train_03200	e be like say dem go beat us together i no get packs to fight	negative
2393	pcm_train_02394	awon ryan el rufai e no dey rate hin followers at all we kuku don chop blocking tey tey	negative
2948	pcm_train_02949	i no wan complain sha na food dey suffer am	negative
4001	pcm_train_04002	abi make i send my account number make me sef smile thanks sir	positive
1765	pcm_train_01766	them no understandso because say na k i dey earni no go fit find love or start a relationship	negative
2746	pcm_train_02747	like why are you looking for me when nothing dey inside wetin you wan use me do madam	negative
1425	pcm_train_01426	fat boys like us we dey find wife but dem no dey rush us dem no dey rush us	negative
4971	pcm_train_04972	imagine me dating u and you dont want me to quarrel or annoy u u wan waste my talent be dat na	positive
391	pcm_train_00392	everytime i see this girls tweet im like werey sheyav tweet nonzenz once again e no dey ever get head rara and na chimmy best girl o	negative
1874	pcm_train_01875	e dey pain dem die	negative
3518	pcm_train_03519	this tl no fit off me this morning thank god say na catchup i dey play because too many stray bullets don fire see as shell dey ground	positive
1913	pcm_train_01914	loooooool won ti lu werey yi pa you go carry wetin pass u later we go dey abuse short girls how she wan popo u like this	negative
2293	pcm_train_02294	lmao deadass made tiktoks and i only posted i didnt even really edit those sef i don de lazy	negative
1029	pcm_train_01030	its easier for me to stomach the british speaking it but im always shocked to hear asians speaking pidgin english especially the chinese which kain yeye beefroll you sell give me yesterday nothing beef about am o my pickin dey halla say e worst pass gala sef	negative
3018	pcm_train_03019	ion dey na if e sure him make him come umuoji	negative
2056	pcm_train_02057	i really get pissed wen short people be like abeg help me pick this thing up me see you see ground pick it	negative
4637	pcm_train_04638	lol im too innocent sir i wan marry sef sir	positive
2741	pcm_train_02742	many of us dont really like real madrid sef na because of ronaldo we dey rush dem	negative
3987	pcm_train_03988	hi nekkar love missed u wait u didnt miss me joint acntna if d undstndg de dia n una no fit manage moni pass us o me d guys input financially shld be higher and if shes d bread winner o badt gon play me thousands mils vanessa carlton	positive
836	pcm_train_00837	im always serious because if i dont get good grades i basically have no backup plan i no get talent like thatto do skit mbanu someone will now ask me why im always in law library fimile	negative
4153	pcm_train_04154	wetin dey sup nah is it that people are not seeing my tweets or they dont just want to engage them please im new here o teach me what to do abeg thanks	positive
4722	pcm_train_04723	see ehn i no dey beg mek anybody follow me like or retweet my pictures but abeg mek una help my ministry retweet my hustle e take too much grace of god for me to bounce back bikonu retweet my pinned tweet please	positive
4540	pcm_train_04541	good morning people we are getting ready to start posting new arrivals oga dikwa kpokpo come and camp on my timeline because i will be serving it hot hot️️ im so excited pls today i go dey tag everybody and anybody abeg nor vex show me love nd retweet	positive
2116	pcm_train_02117	all these rubbish takes would have ended messi na idiot walahi	negative
989	pcm_train_00990	on your way from lagos to abuja and bus stops for everyone to eat only for you to be told bros no be that guo you follow dem don look for you so tey the driver don go o	negative
4529	pcm_train_04530	whichever way make cun open bank for where we fit dey see each other una thank you for helping me save	positive
3696	pcm_train_03697	lmao omo that time person go dey record rhythm and ray power jamz on don moen tapes chop beating after sef	positive
2703	pcm_train_02704	twitter come to my rescue ooo im in severe pain rn see wetyn my blood brother dey do me same mama o money wey i wan use buy light	negative
3163	pcm_train_03164	for this person now man utd playing beautiful football no concern am na just to win and thats what jose does as a chelsea fan sef im worried	negative
3721	pcm_train_03722	reposted from chioma no be amaka she no dey disappoint davido and chioma una matter don reach church ooo you love our post why not follow us for more	positive
819	pcm_train_00820	i wanna thank my god for blessings and letting me grow na na i wanna thank my fans for support and letting me blow na na lord i give everything to you my life and soul na na i wanna thank my mum for bringing me into life na na i dedicate everything to you my fans all over	negative
4532	pcm_train_04533	boss wetin dey shele gangan sef na so i no lucky reach i tire o	positive
4333	pcm_train_04334	this was how our client enjoyed herself and she said it was totally worth it if you wan chop this life ehn chop am with your full chest so order nice treats for yourself this weekend dont say i didnt do anything for you	positive
1039	pcm_train_01040	god what is dis one na angel gabriel what is wrong with the trumpet na is it not clean enough blow d thing na were tired whose child and brother is this na lagos state	negative
3128	pcm_train_03129	see dem awon werey omo ole god punish anybody wey faint for court para dey oooo	negative
500	pcm_train_00501	e be like na to move osince access took over diamond na problem	negative
1328	pcm_train_01329	foreeal when light no dey to charge phone how light wan dey to charge power ban lol power bank always on low	negative
2341	pcm_train_02342	pediatrics wardround consultant madam this ur pikin don get measles before mother na only once e don convulse consultant	negative
3443	pcm_train_03444	november is here ya allah ur boy i mean me has professional exams dis month bless my memory and studies if i study just its just that that should come out im not trying to be petty buh god you sef know as e dey be nw	positive
2169	pcm_train_02170	e still far o	negative
1093	pcm_train_01094	them don talk say anything wey premium times like make them write about peter hin tu lai say nah distraction from the nasco fiction by their award winning journo the agenda is not for a better opportunity or better nigeria the agenda is to push their own narration ️	negative
380	pcm_train_00381	where una dey see this love make una remain small dash me na	negative
3478	pcm_train_03479	you like wahala abeg tinpin no even de look their face	positive
413	pcm_train_00414	omo job hunting go humble you you go just dey greet everybody good morning sir im fine ma alright sir thank you ma the banks wey i go this morning i don waste my sir and ma on top their heads	negative
50	pcm_train_00051	am ur biggest fan person blow me for mouth coz of you we dey argue u and olamide who get vibes pass i argue they tell dem sey na get vibes pass before u no wetin dey happen wey don dey argue i no know wen i call the boy bastard out of anger the guy blow me	negative
4620	pcm_train_04621	uriel don strt wit englishsha go n eat d disgusting food n vomit well cos u don dey practise since	positive
2784	pcm_train_02785	u don dey feel like saviour abeg shift	negative
3458	pcm_train_03459	na wenger make me stop to dey go the embarrassment of of hearing rival fans taunt you with one by one them don dey go when bayern is leading	positive
5075	pcm_train_05076	the way im rushing this series ion wan make e finish na to dey watch episodes per day	positive
788	pcm_train_00789	armed robbers dey front bridge don collapse civil war don start rapture don come	negative
4926	pcm_train_04927	i never ask anything from you im a titan im not good and im dry please bless me anyhow my queen even if na small i just want to have the mouth that you noticed me my queen	positive
3091	pcm_train_03092	lagos people make una leave burna boy for a while why una be like dis nah	negative
2501	pcm_train_02502	e be like say pastor don tell this bros say na hospital he go find wife you see nurse carry front carry back use nose mask use glasses wear hair net everything covered up you dey tell her she is beautiful bros you are a born liar joor why are we like this sef	negative
1551	pcm_train_01552	whats wrong with this people sef haba lets us eat food finish	negative
3974	pcm_train_03975	my people ohhhh una won better smoked fish when don first chop belle full na chiwinkx smoked fish be dat na our correct kg fishes dem wen we don cut wrinse well well con sauce	positive
1892	pcm_train_01893	since i don de bayelsa i never see person like nengi where una de hide	negative
3005	pcm_train_03006	dem wan mud smallie for wetin no concern am	negative
3682	pcm_train_03683	naso me and sef hug ourselves dey scream inside car	positive
1770	pcm_train_01771	lmao no be today narain don dey beat vulture tey tey its still the same thank you for banking with us	negative
1896	pcm_train_01897	i swear na wetin me sef dey fear be that ooo make he no go follow trump mouth support one side of the war cause we go suffer gan we wey we never fight boko haram finish na wan con go face iran single technology wey no get omo make we forget ham we are all dead	negative
3740	pcm_train_03741	na who dey alive dey buy fabric wey dem go use sew cloth my yard people see better fabric abeg try and swipe left and watch videos too we dey sell better n send us a dm for payment details	positive
3498	pcm_train_03499	bros e never still reach you this delivery service tey o no give me red card o i no play betway na podcast i wan do o help me tell am na abeg twitter how far na help a brother	positive
2283	pcm_train_02284	hate when my premonition tells me things and i dont do it immediately now whole breakfast has casted all over the floor who has cleaning company please no be more go do this wahala wit all these oil please who has breakfast let me visit them abeg while they are cleaning	negative
2361	pcm_train_02362	omo na casting be this oh especially at the time nigerians get as dem dey look dem	negative
3589	pcm_train_03590	happy birthday to you wish u long life and plenty moneyenjoy your dayand please no dey as u dey for dis pics today oooo make u do ur face well oga happy birthday once again	positive
3944	pcm_train_03945	time tiri gbosa for the person wey born you i never want to try lose you try dem no born me well i no fit tire for your matter lai lai say i no do suddenly man calm down man down for only you	positive
4105	pcm_train_04106	boys dont cry this weekend im so ecstatic	positive
1741	pcm_train_01742	so if we play watin go happen you fit no score bro	negative
3316	pcm_train_03317	the man fit later even die of hypertension when e sidown for room dey think this thing being a parent will push you until you leave your shell especially when you get pikin like us wey been no dey too hear word when we small	positive
3247	pcm_train_03248	uriel don strt wit englishsha go n eat d disgusting food n vomit well cos u don dey practise since	negative
3232	pcm_train_03233	shey female anon no dey ni na only macbook i need anon maybe i should update my twitter because its like im on a different twitter app	negative
3762	pcm_train_03763	some people fit nor understand me sha based say i dey on wisdom grass as i dey smoke this write as i dey write this tweet but nor worry if you nor fit reason am nor stress yourself just like and retweet am before you go	positive
125	pcm_train_00126	guys today a girl fine girl wey fine reach meal on a hungry eve gave me her iphone pro to help her hold it till she finish drinking water i wanted to run but na for motor park we de i no i go chop beating sotey i go wish i die	negative
4686	pcm_train_04687	daddy abeg before e come some of ys dey earth already we might mot be related by flesh but by spirit	positive
266	pcm_train_00267	de gea that free kick was like that dude said wait hol up yoh degea hold ma beer im crying now my wey i for use go buka chop just waste this afternoon so manu don collect	negative
795	pcm_train_00796	who get phone wey e no de use again my phone has spoilt last last the screen be like e de high dey touch here and thereyo type this tweet na war epppp	negative
610	pcm_train_00611	poco lee abeg me sef wan blow incrediblenoble don blow today oo	negative
4383	pcm_train_04384	i swear jide read pass me for that exam i was too confident like wetin baba wan set wey i no go sabi baba sly me	positive
4765	pcm_train_04766	someone told me im better with male friends than females im beginning to concur to that o is like na true o	positive
4922	pcm_train_04923	e be like say you sef don know your accent no go let us hear anything on nta thanks for reposting on here sir	positive
189	pcm_train_00190	lowkey we suppose sue that grammy award winning singletwearing short man you sef listen to this fire na dear na on sight if i ever catch you on why do you like hoarding music like its indomieeeennnnnnn why	negative
3999	pcm_train_04000	todays orders nessas sweet chicken sb nessas sweet waffles gizdodo our spaghetti bolognese is a big hit e don dey chase me for dream sef please yall should check our menus for other wonderful mouth watering dishes youll be glad you did	positive
2030	pcm_train_02031	lol e get d way e go dey do you wey u no go fit hide am	negative
4721	pcm_train_04722	cant wait to open my luxury incense and humrah ️ from kamshi kamshi bakhoor ️️ the scents is all over already sef	positive
1864	pcm_train_01865	baba help me i cant afford to miss this job all i need it small boost so i can travel down the uyo from ph e no easy to get job for this coro period	negative
1363	pcm_train_01364	i wonder weda na ronaldo tell ole say e wan rest	negative
3416	pcm_train_03417	normal charcoal pencil wey i dey buy k nteps sell gimme for i bin dey reason say i wise untill i use the pencil last night the charcoal nuh fit blend my hb pencil better pass am sef e nuh go better for mont marte charcoal pencil	positive
4278	pcm_train_04279	today is for dumebi i like d jam die i nr know wetin i dy do o but i know im dancing laff me make i block u a diff kinda tailor swag tailor tailor wey nr dy suffer	positive
2976	pcm_train_02977	you never help to dey gather money den they curse you on top your voluntary analysis wetin dem go con do if you dey help raise money for voting and stuff oga abeg reason am well o	negative
1601	pcm_train_01602	wetin dey happen make rose dey calm down	negative
3768	pcm_train_03769	omo see fine bae bae hw far waiting u dey look for here if na bf i dey here for u	positive
1931	pcm_train_01932	dear anon i don wait sote i don dey loose weight ooooo	negative
3397	pcm_train_03398	i swear well e be like say oppo don show all of them say levels dey na why dem come with stronger agenda and hashtags na eyeopener na now dem remember say life dey after bbn or without winning	positive
3117	pcm_train_03118	now abi could have even gone ahead i no dey watch again na me dey jinx am	negative
1663	pcm_train_01664	stop shiftin facts n focus fo say na inky u sabi read bsides u dint discova dt dos dt did gave ref n many wrote too srry bt nt dis time sir	negative
2087	pcm_train_02088	comot that akure wey dey your handle abeg you dunno anything	negative
473	pcm_train_00474	see bah asides good health financial security is everything ive written down my list for panic buyingstock up with several adjustments to fit in with money in my account but its not just adding up oluwa wetin dey coronate	negative
4044	pcm_train_04045	baba i for like follow you ansa as edey my mind oo but sha dem no count our chips dey plenty de client bin dey in a hurry and we had to send the first chips we added more later hope i dong enta your good book now	positive
2568	pcm_train_02569	na do as others dey do dey worry us now since we have never say down to proffer solutions to our own problems poverty capital of the world testing about k plus people per day instituting a lockdown without a robust economic stimulus package	negative
2446	pcm_train_02447	lmaoeven girl wey dey her period no dey run mouth like that guyi was disappointed coming from a grown man like that	negative
4076	pcm_train_04077	if i no post review wetin i gain buy nirvana u no hear now my baby girlextraordinary presenterblaque beauty joyceiyakwari is giving it to them left and right in her double drawn fringe wig	positive
4575	pcm_train_04576	normal guys stuff sha una sabi how many times una dey argue for osogbo that time even on top small wot	positive
5066	pcm_train_05067	girl you just de blow my mind	positive
3426	pcm_train_03427	as a jobless youth hustling you will enter cab with employed dude wey de earn big and heshe will be waiting for you to pay for em abeg which economic system is that	positive
8	pcm_train_00009	today marks one small milestone in the beautiful journey of lifei believe dat im the equivalent to a fine wine or a delicious cheesed older the better im trilled to be another year today i create within me a vacuum that no one can and will ever fill except god	negative
1642	pcm_train_01643	man im so pissed even when im not watching them play because what in gods name does that nigga do how does he think why play andreas and shaw why keep greenwood and mata on the bench	negative
4179	pcm_train_04180	na una people na i want to be like you guys when i grow up	positive
1234	pcm_train_01235	dis is nt ibb sayin dis trash here dis is d handiwrk of satanic hackers	negative
1267	pcm_train_01268	my dear i dey fear e don dey reach this side ooo	negative
2371	pcm_train_02372	has never dashed out any money less than k before na why wont i be angry he will just come gbam like say k na naira im angry mtcheewwwwwwwwwwwwwwwwwwwwwwwwwwwwwwwwwwwwwwwwwwwwwwwwwwww	negative
2484	pcm_train_02485	lol i just dey here dey laugh im obviously not their target market	negative
145	pcm_train_00146	this go hard ooo albino go throw e neighbor pikin up but e no come see the pikin catch again we still de settle	negative
1383	pcm_train_01384	how will i read this one sef	negative
3349	pcm_train_03350	no b me dey do na na support i dey support oh	positive
3063	pcm_train_03064	hold on na this same premier league i watched abi na another one wey people dey tip kante for player of the year ‍️‍️	negative
1965	pcm_train_01966	rubbish club don spoil my ticket join	negative
2853	pcm_train_02854	me my guy abeg take earphone upcoming artist thank you me dey plug am anytime you dey play your song around me upcoming artist ok	negative
2738	pcm_train_02739	tweeps tweeps tweeps i call una wetin they happen now i don reach like years for the twitter ordinary k followers i never celebrate just now now just right now motara create acct e don almost enter k plus oh god of followers take your people to my follow button	negative
3711	pcm_train_03712	abeg im a sweet guy any gathering for me na blessings no be curse	positive
4281	pcm_train_04282	na you first shout like say the igbo song call your name na you first jump ontop stage na you first bend down please sir i cant stop what i didnt start	positive
1951	pcm_train_01952	what is these peoples problem sef now now dey don form swat but our demand was taking a process shey we are a joke to them in short ehn ‍️‍️ did we say we want change of name ni ‍️	negative
1109	pcm_train_01110	you deh pay your babe school fees yet you never write jamb ohboy you be scholarship board uncle check ur dodo e dey burn	negative
3574	pcm_train_03575	me wey dey agitate dey high people moral na him one girl just dey come high my soul every seconds hello dearie you are doing well omo i motivate dye extra ginger to sing solidarity song	positive
3863	pcm_train_03864	tz just soo cute wen a guy is rily nervous talking to u wen e cn hardly look at ur face sef	positive
2922	pcm_train_02923	jessssuuuu mio na trailer wey dey bring bribery rice kon end peoples lives like this people wey still dey reason how to go to church tomorrow see sunday lord have mercy we know the talk on the streets would be connect to diabolical influence and i agree	negative
2231	pcm_train_02232	na why you no fit ever talk shortingo	negative
2426	pcm_train_02427	lol alcohol don dey enter dia body	negative
1876	pcm_train_01877	pediatrics wardround consultant madam this ur pikin don get measles before mother na only once e don convulse consultant	negative
3483	pcm_train_03484	the doctor on duty this weekend na just weyrey i swear small headache admission straight i don dispense nsaline and dsaline like say na small chops am do reach abeg	positive
1102	pcm_train_01103	mb dey waste na what happen who is that person pls	negative
541	pcm_train_00542	overnice haff killed meaunty don go use money for goods do birthdaycome dey tell me say nothing wey i fit do about it the way my head is boiling and people asking me to go to her housei go rough handle her which i will never do women can pretend o like fucking pretend	negative
3783	pcm_train_03784	chai its doing me as if na me dem dey blow kiss to	positive
1232	pcm_train_01233	the kind lie people na e dish na this twitter na agba mụ anya mmiri makachi people can lie ooo	negative
2983	pcm_train_02984	my guy just called amala garbage smh na why dem nor dey rate benin boys for lagos	negative
4523	pcm_train_04524	a client gave me k to make a birthday cake for her daughter with icing sugar i told her ma this money wont be enough to do what you want my mum was like do it for her na na we we in my mind shey baby we we i dey use fo market i dont like doing business with my mums crew	positive
3816	pcm_train_03817	ive already boned sef	positive
3541	pcm_train_03542	oya ohhh make every business owner go watch this video times ooo e go do you well because plenty of us don dey do business the wrong way shey na true talk be that even if you attended the free day esme money bootcamp with try to watch again	positive
2398	pcm_train_02399	so you dont want to follow me i have your notifications up i retweet your tweet i watch you say lol to almost every topic your retweet sef dey finish my data you still jo wan follow back god dey sha	negative
4231	pcm_train_04232	as e de pursue naso de meat the sweeet pass	positive
402	pcm_train_00403	this fake life has finally land me into trouble when i think say we dey plenty for single life omo everyone don sort them selves out sha dey con dey use the singu life we gather dey before dey mock me	negative
2203	pcm_train_02204	ussy broke man no dey sleep	negative
4876	pcm_train_04877	my gender and wahala wahala for who be nurseyou go turn nurse doctor consultant all at same time stop doing if you are not ready or better still take precautions na you people wee now be acting surprised o wrong now mtcheew	positive
4022	pcm_train_04023	hahahaba mana try and trust them we fit win o	positive
693	pcm_train_00694	forger hype abeg because of the love i get for the guy i play the album overnight just so the thing go enter body but as i wake i still low on vibe the tracks get as then be jare all na low vibe things and den fit putset you for boredom moodmode	negative
4408	pcm_train_04409	na the work wey we dey do we give you an i want more experience with our beautiful and yummy cakes send a whatsapp message via to place your orders ikorodu	positive
165	pcm_train_00166	na for where we go settle matter naim person slap me for eye i no see who slap me me sef con slap the short man wey dey my side i no know say na soldier we don dey drive go barracks like this	negative
342	pcm_train_00343	wetin this one dey try talk how person wan understand anything like this	negative
2712	pcm_train_02713	what kind of heat is this sef im tired i just wanna shed my skin cos e be like say my ac don dey back up	negative
558	pcm_train_00559	e be like say na military bank cos we bloody civilians them dey chance us o	negative
4204	pcm_train_04205	kayodeeeee why switch the camera na na this kind mood dey result months pls go back to the hoh lounge	positive
665	pcm_train_00666	peace wey una don pieces overcalcu don dey do baba ontop tollgate money wey no enter join me laugh biko	negative
